"Id","Place name","Email","Phone","Address","Hours","Location","Reviews count","Category","Total score","website"
"1","General Mariano Alvarez Technical High School","","0464439890","688 Congressional Rd, Poblacion 1, General Mariano Alvarez, 4117 Cavite","Thursday:[8 AM–4 PM],Friday:[8 AM–4 PM],Saturday:[Closed],Sunday:[Closed],Monday:[8 AM–4 PM],Tuesday:[8 AM–4 PM],Wednesday:[8 AM–4 PM]","https://www.google.com/maps?cid=14893166072439757145","48","High school","4.2","null"
"2","Maranatha Christian Academy of GMA","","0465421142","72P2+725, Congressional Rd, General Mariano Alvarez, 4117 Cavite","","https://www.google.com/maps?cid=16943780078000666623","5","Religious school","4.6","null"
"3","Holy Family Academy Of GMA, Cavite","","0464604145","72X5+PR2, Congressional Rd, Poblacion 1, General Mariano Alvarez, 4117 Cavite","","https://www.google.com/maps?cid=13570237820425764435","2","Religious school","5","null"
"4","Area J Elementary School","","0466968842","72R2+6R5, J. Lumbreras General Mariano Alvarez Cavite, General Mariano Alvarez, Cavite","Thursday:[7 AM–5 PM],Friday:[7 AM–5 PM],Saturday:[Closed],Sunday:[Closed],Monday:[7 AM–5 PM],Tuesday:[7 AM–5 PM],Wednesday:[7 AM–5 PM]","https://www.google.com/maps?cid=13168689243691210328","9","Elementary school","4.1","null"
"5","Shekinah Learning School","","","Blk 11 Lot 30 San Jose, General Mariano Alvarez, Cavite","","https://www.google.com/maps?cid=15699829280593640658","12","School","4.3","null"
"6","Alta Tierra Integrated School, Inc.","","0464125137","Blk. 1, Lot 4, Alta Tierra Homes, Brgy. A, General Mariano Alvarez, Cavite","Thursday:[7 AM–4 PM],Friday:[7 AM–4 PM],Saturday:[Closed],Sunday:[Closed],Monday:[7 AM–4 PM],Tuesday:[7 AM–4 PM],Wednesday:[7 AM–4 PM]","https://www.google.com/maps?cid=9536554238285448657","null","School","null","facebook.com"
"7","Grace Baptist Christian School","","","72R3+29H, Congressional Rd, General Mariano Alvarez, Cavite","","https://www.google.com/maps?cid=7290696628318883881","2","Private educational institution","4.5","null"
"8","My Messiah School Of Cavite","","0465421169","72W4+HRR, Ignacio, Poblacion 1, General Mariano Alvarez, 4117 Cavite","","https://www.google.com/maps?cid=6405534221602438108","10","School","3.4","null"
"9","Paaralang Elementarya ng Bulihan (107937)","","0464604266","72M2+29X, Governor's Dr, San Gabriel, General Mariano Alvarez, 4117 Cavite","Thursday:[5 AM–6 PM],Friday:[5 AM–6 PM],Saturday:[Closed],Sunday:[Closed],Monday:[5 AM–6 PM],Tuesday:[5 AM–6 PM],Wednesday:[5 AM–6 PM]","https://www.google.com/maps?cid=10921400241320862510","3","Elementary school","5","null"
"10","Christian Grace School of Cavite","christiangraceschool@gmail.com,christiangraceshool@gmail.com","0464105901","CGS Building, Mindanao Ave, Brgy Maderan, General Mariano Alvarez, 4117 Cavite","Thursday:[7 AM–6 PM],Friday:[7 AM–6 PM],Saturday:[8 AM–4 PM],Sunday:[Closed],Monday:[7 AM–6 PM],Tuesday:[7 AM–6 PM],Wednesday:[7 AM–6 PM]","https://www.google.com/maps?cid=7250164988485072921","4","School,Elementary school,Senior high school","4","cgscavite.com"
"11","San Gabriel 2 Elementary School","","0466968844","147 Congressional Rd, M. Memite, General Mariano Alvarez, 4117 Cavite","Thursday:[7 AM–5 PM],Friday:[7 AM–5 PM],Saturday:[Closed],Sunday:[Closed],Monday:[7 AM–5 PM],Tuesday:[7 AM–5 PM],Wednesday:[7 AM–5 PM]","https://www.google.com/maps?cid=11501879883972808237","16","Elementary school","3.9","null"
"12","Victorious Christian Montessori","","","72Q3+WJ8, 323 Congressional Rd, General Mariano Alvarez, Cavite","","https://www.google.com/maps?cid=841853817814439625","6","Primary school","2","null"
"13","SAN GABRIEL 3 ELEMENTARY SCHOOL","","","8267+36Q, General Mariano Alvarez, Cavite","Thursday:[7 AM–4 PM],Friday:[7 AM–4 PM],Saturday:[Closed],Sunday:[Closed],Monday:[7 AM–4 PM],Tuesday:[7 AM–4 PM],Wednesday:[7 AM–4 PM]","https://www.google.com/maps?cid=6827276889635141381","5","University","4.6","null"
"14","Legion Of Mary Learning Institute","","","72V2+3F2, General Mariano Alvarez, Cavite","","https://www.google.com/maps?cid=11156864382066527630","null","Elementary school","null","null"
"15","Grace of Christ Christian School","","","Blk12, lot 113 kamatis street, General Mariano Alvarez, 4117 Cavite","Thursday:[8 AM–5 PM],Friday:[8 AM–5 PM],Saturday:[Closed],Sunday:[Closed],Monday:[8 AM–5 PM],Tuesday:[8 AM–5 PM],Wednesday:[8 AM–5 PM]","https://www.google.com/maps?cid=13008795090393625855","2","School","3.5","null"
"16","Vessel of Wisdom Christian School","","0468902677","258 Mt. Mayon J.P. Elises, General Mariano Alvarez, Cavite","Thursday:[6:45 AM–5 PM],Friday:[6:45 AM–5 PM],Saturday:[Closed],Sunday:[Closed],Monday:[6:45 AM–5 PM],Tuesday:[6:45 AM–5 PM],Wednesday:[6:45 AM–5 PM]","https://www.google.com/maps?cid=12628275849595058826","1","Private educational institution","5","null"
"17","Archangel Barachiel Center for Development Inc.","","09232330330","117-118 Biology St. Brgy. Inocencio Salud, General Mariano Alvarez, 4117 Cavite","Thursday:[7 AM–5 PM],Friday:[7 AM–5 PM],Saturday:[Closed],Sunday:[Closed],Monday:[7 AM–5 PM],Tuesday:[7 AM–5 PM],Wednesday:[7 AM–5 PM]","https://www.google.com/maps?cid=8013560510479357687","1","Private educational institution","5","facebook.com"
"18","Vox Dei Academy","","0462310545","A.L Ignacio, Poblacion 1, General Mariano Alvarez, 4117 Cavite","Thursday:[7 AM–5 PM],Friday:[7 AM–5 PM],Saturday:[Closed],Sunday:[Closed],Monday:[7 AM–5 PM],Tuesday:[7 AM–5 PM],Wednesday:[7 AM–5 PM]","https://www.google.com/maps?cid=1790550515582493590","12","School","3.8","null"
"19","D' Little Angels Christian School","","09177388145","B5 L2 Teachers Village, General Mariano Alvarez, Cavite","","https://www.google.com/maps?cid=8807915745682810503","null","School","null","null"
"20","Evangelical Christian School Foundation Inc.","","0285564251","Block 1 Lot 6 Barangay Nicola Virata, General Mariano Alvarez, 4117 Cavite","Thursday:[8 AM–4 PM],Friday:[8 AM–4 PM],Saturday:[Closed],Sunday:[Closed],Monday:[8 AM–4 PM],Tuesday:[8 AM–4 PM],Wednesday:[8 AM–4 PM]","https://www.google.com/maps?cid=14964644115506798806","null","Private educational institution","null","null"